<?xml version="1.0" encoding="UTF-8"?>
<gen:GenModel xmlns:gen="http://gensmd.local/genmodel" xmlns:xsi="http://www.w3.org/2001/XMLSchema-instance" xsi:schemaLocation="http://gensmd.local/genmodel genmodel.xsd">
<SelectorList>
  <Selector cond="weight = 1">
    <ElementType geomType="line" weight="3" />
    <RelationList>
      <RelationSelector cond="false" join="">
        <Relation clearance="1.2" />
		    <Footprint>
		      <Geometry>
		        <Wkt>POLYGON(....)</Wkt>
		        <Origin x="0" y="1.0" />
		      </Geometry>
		      <Buffer radius="0.2" cap="flat" offset="1.1" />
		    </Footprint>
      </RelationSelector>
    </RelationList>
  </Selector>
  <Selector cond="true">
    <ElementType geomType="line" weight="3" />
    <RelationList>
      <RelationSelector cond="1=0" join="true">
        <Relation clearance="1.2" />
      </RelationSelector>
    </RelationList>
  </Selector>
</SelectorList>
<ElementTypeList>
  <ElementType id="1720000" geomType="line" weight="1">
    <TagDict>
      <Tag key="color" value="red" />
    </TagDict>
    <TagList>
      <Tag>silnice</Tag>
      <Tag>seda</Tag>
    </TagList>
    <Footprint>
      <Geometry>
        <Wkt>POLYGON(....)</Wkt>
        <Origin x="0" y="1.0" />
      </Geometry>
      <Buffer radius="0.2" cap="flat" offset="1.1" />
    </Footprint>
  </ElementType>
  <ElementType id="545454545" geomType="line" weight="1">
    <TagList>
      <Tag>topo</Tag>
      <Tag>silnice</Tag>
      <Tag>seda</Tag>
    </TagList>
    <Footprint>
      <Buffer radius="0.2" cap="flat" offset="1.1" />
    </Footprint>
  </ElementType>
</ElementTypeList>

</gen:GenModel>